{
  "id": "probe-1d1f7b",
  "label": "x07-counter-offer-spacing",
  "title": "Probe: o03 with a space as thousands separator",
  "benchmarkVersion": "2.0.0",
  "family": "offer-vs-agreement",
  "nature": "synthetic",
  "v1Case": null,
  "propositions": [
    {
      "id": "p1",
      "step": "s1",
      "candidate": "c1",
      "target": "delivery",
      "acceptable": [
        {
          "outcome": "ADMIT-QUALIFIED",
          "reason": "offer_not_agreement",
          "record": {
            "recordType": "offer",
            "subject": "org:northfield-components",
            "attributedTo": "org:buyer-b",
            "actingFor": "org:buyer-b",
            "fields": {
              "object": "HX-40 housings",
              "quantity": 18000,
              "dueBy": "2026-11-30",
              "price": "USD 1.85",
              "debtor": "org:northfield-components",
              "creditor": "org:buyer-b"
            },
            "evidenceMaterials": [
              "m2"
            ],
            "validity": {
              "from": "2026-10-08",
              "to": null
            },
            "allowedVariance": {
              "confirmedBy": [
                [
                  "org:buyer-b"
                ]
              ]
            }
          }
        }
      ],
      "rules": [
        "R-OFFER-1"
      ],
      "why": "Same meaning as o03.",
      "criticalIfPersisted": null
    }
  ],
  "reads": [
    {
      "read": "q1",
      "expected": {
        "status": "value",
        "recordType": "offer",
        "attributedTo": "org:buyer-b",
        "fields": {
          "quantity": 18000
        },
        "qualifiers": []
      },
      "restricted": false,
      "rules": [
        "R-READ-4"
      ],
      "why": "Counter-offer."
    }
  ]
}
