{
  "id": "case-dc6ff1",
  "label": "e02-account-binds-identity",
  "title": "The same short signature from an authenticated account",
  "benchmarkVersion": "2.0.0",
  "family": "wrong-entity-or-scope",
  "nature": "synthetic",
  "v1Case": null,
  "propositions": [
    {
      "id": "p1",
      "step": "s1",
      "candidate": "c1",
      "target": "lead_time",
      "acceptable": [
        {
          "outcome": "ADMIT",
          "reason": "as_stated_claim",
          "record": {
            "recordType": "claim",
            "subject": "org:northfield-components",
            "attributedTo": "org:northfield-components",
            "actingFor": "org:northfield-components",
            "fields": {
              "product": "HX-40",
              "value": 6,
              "unit": "week"
            },
            "evidenceMaterials": [
              "m1"
            ],
            "validity": {
              "from": "2026-10-05",
              "to": null
            }
          }
        }
      ],
      "rules": [
        "R-ID-1",
        "R-AUTH-1"
      ],
      "why": "Same wording as e01, but the account binds the subject. A system that holds every short signature fails here.",
      "criticalIfPersisted": null
    }
  ],
  "reads": [
    {
      "read": "q1",
      "expected": {
        "status": "value",
        "recordType": "claim",
        "attributedTo": "org:northfield-components",
        "fields": {
          "product": "HX-40",
          "value": 6,
          "unit": "week"
        },
        "qualifiers": []
      },
      "restricted": false,
      "rules": [
        "R-READ-2"
      ],
      "why": "One claim."
    }
  ]
}
